{
  "$schema": "../../../schemas/records/event.schema.json",
  "schema_version": "1.0.0",
  "id": "event.clone_agreement_vector",
  "record_type": "event",
  "data": {
    "id": "event.clone_agreement_vector",
    "title": "Founding clone agreement — Vector Graphic",
    "event_type": "agreement",
    "date": {
      "start": "1981-03-03",
      "end": "1981-03-03"
    },
    "participants": [
      {
        "actor_ref": "actor.logix",
        "role": "programme_partner"
      },
      {
        "actor_ref": "actor.aion",
        "role": "programme_partner"
      },
      {
        "actor_ref": "actor.vector",
        "role": "programme_partner"
      }
    ],
    "actions": [
      {
        "actor_refs": [
          "actor.logix",
          "actor.aion",
          "actor.vector"
        ],
        "description": "Protect roadmap confidentiality and predictable margins; equal access to qualified silicon revisions. Initial target: one qualified Aurelia-class configuration and one Artemis configuration in January 1982. Existing products may continue."
      }
    ],
    "outcomes": [],
    "metrics": [],
    "product_refs": [],
    "related_event_refs": []
  }
}
