{
  "$schema": "../../../schemas/records/event.schema.json",
  "schema_version": "1.0.0",
  "id": "event.clone_agreement_goupil",
  "record_type": "event",
  "data": {
    "id": "event.clone_agreement_goupil",
    "title": "Founding clone agreement — SMT Goupil",
    "event_type": "agreement",
    "date": {
      "start": "1981-03-05",
      "end": "1981-03-05"
    },
    "participants": [
      {
        "actor_ref": "actor.logix",
        "role": "programme_partner"
      },
      {
        "actor_ref": "actor.aion",
        "role": "programme_partner"
      },
      {
        "actor_ref": "actor.goupil",
        "role": "programme_partner"
      }
    ],
    "actions": [
      {
        "actor_refs": [
          "actor.logix",
          "actor.aion",
          "actor.goupil"
        ],
        "description": "Retain French identity and local applications; phase product introduction and inventory finance. Initial target: one qualified Aurelia-class configuration and one Artemis configuration in January 1982. Existing products may continue."
      }
    ],
    "outcomes": [],
    "metrics": [],
    "product_refs": [],
    "related_event_refs": []
  }
}
