{
  "$schema": "../../../schemas/records/event.schema.json",
  "schema_version": "1.0.0",
  "id": "event.autodesk_beta",
  "record_type": "event",
  "data": {
    "id": "event.autodesk_beta",
    "title": "AutoCAD Artemis beta and professional workflow qualification",
    "event_type": "development",
    "date": {
      "start": "1982-09",
      "end": "1982-09"
    },
    "participants": [
      {
        "actor_ref": "actor.adam",
        "role": "programme_partner"
      },
      {
        "actor_ref": "actor.logix",
        "role": "programme_partner"
      },
      {
        "actor_ref": "actor.aion",
        "role": "programme_partner"
      },
      {
        "actor_ref": "actor.labs",
        "role": "programme_partner"
      },
      {
        "actor_ref": "actor.autodesk",
        "role": "programme_partner"
      }
    ],
    "actions": [
      {
        "actor_refs": [
          "actor.adam",
          "actor.logix",
          "actor.aion",
          "actor.labs",
          "actor.autodesk"
        ],
        "description": "Test representative drawings, numerical accuracy, dual displays, mouse routing, file/DXF exchange, plotter output, memory/storage limits, crash recovery and reproducible builds. Adam funds necessary engineering and equipment to remove delivery blockers; Autodesk retains ownership and other-platform support. Programme details: team_development_program.json."
      }
    ],
    "outcomes": [],
    "agreement_terms": [],
    "metrics": [],
    "product_refs": [
      "computer.artemis_pro",
      "software.aion_development_team",
      "software.autocad_1_artemis",
      "device.artemis_professional_video_128kb",
      "device.mono_pro_17",
      "device.logix_mouse"
    ],
    "related_event_refs": [
      "event.autodesk_agreement"
    ]
  }
}
