{
  "$schema": "../../../schemas/records/event.schema.json",
  "schema_version": "1.0.0",
  "id": "event.bpi_offer",
  "record_type": "event",
  "data": {
    "id": "event.bpi_offer",
    "title": "Investment and cooperation offer to independent BPI Systems",
    "event_type": "offer",
    "date": {
      "start": "1977-02-15",
      "end": "1977-02-15"
    },
    "participants": [
      {
        "actor_ref": "actor.adam",
        "role": "offeror"
      },
      {
        "actor_ref": "actor.bpi",
        "role": "recipient"
      }
    ],
    "actions": [
      {
        "actor_refs": [
          "actor.adam"
        ],
        "description": "Adam proposes cash investment and a separately incorporated BPI Systems venture, retaining the BPI brand and independent management, with development cooperation from AION and distribution cooperation from Logix."
      }
    ],
    "outcomes": [
      {
        "description": "Proposed BPI management retains product, licensing and specialist-support responsibility. AION engineers assist the C port, database and TUI implementation under agreement. The offer is not evidence of a completed equity transaction."
      }
    ],
    "metrics": [],
    "product_refs": [
      "software.bpi_suite"
    ],
    "related_event_refs": []
  }
}
