{
  "$schema": "../../../schemas/records/event.schema.json",
  "schema_version": "1.0.0",
  "id": "event.ibm_os_program",
  "record_type": "event",
  "data": {
    "id": "event.ibm_os_program",
    "title": "IBM funds an alternative OS delivery programme",
    "event_type": "development",
    "date": {
      "start": "1980-07-15",
      "end": "1980-07-15"
    },
    "participants": [
      {
        "actor_ref": "actor.ibm",
        "role": "participant"
      }
    ],
    "actions": [
      {
        "actor_refs": [
          "actor.ibm"
        ],
        "description": "After evaluating suppliers, fund substitute OS work and stabilise application interfaces. Supplier identity and OS name remain unresolved. Hardware development proceeds; development, utilities, application ports and service preparation now determine commercial timing."
      }
    ],
    "outcomes": [],
    "agreement_terms": [],
    "metrics": [],
    "product_refs": [],
    "related_event_refs": [
      "event.ibm_os_review"
    ]
  }
}
