{
  "$schema": "../../../schemas/records/event.schema.json",
  "schema_version": "1.0.0",
  "id": "event.ncc82_developer_sessions",
  "record_type": "event",
  "data": {
    "id": "event.ncc82_developer_sessions",
    "title": "NCC developer and independent manufacturer sessions",
    "event_type": "development",
    "date": {
      "start": "1982-06-08",
      "end": "1982-06-08"
    },
    "participants": [
      {
        "actor_ref": "actor.logix",
        "role": "organizer"
      },
      {
        "actor_ref": "actor.aion",
        "role": "organizer"
      },
      {
        "actor_ref": "actor.academy",
        "role": "organizer"
      }
    ],
    "actions": [
      {
        "actor_refs": [
          "actor.logix",
          "actor.aion",
          "actor.academy"
        ],
        "description": "Demonstrate Team Edition at its $745.23 adoption price, provide target/API documentation, porting clinics and partner compatibility demonstrations. Funding does not imply exclusive software ownership. Budget and campaign plan: ncc_1982_campaign.json."
      }
    ],
    "outcomes": [],
    "agreement_terms": [],
    "metrics": [],
    "product_refs": [
      "device.artemis_video_card_64kb",
      "device.color_pro_14",
      "device.logix_mouse",
      "device.artemis_professional_video_128kb",
      "device.mono_pro_17",
      "software.entertainment_suite",
      "technology.logix_tui_mouse"
    ],
    "related_event_refs": [
      "event.ncc82_graphics_mouse"
    ]
  }
}
