{
  "$schema": "../../../schemas/records/event.schema.json",
  "schema_version": "1.0.0",
  "id": "event.bpi_training",
  "record_type": "event",
  "data": {
    "id": "event.bpi_training",
    "title": "BPI training and direct sales begin",
    "event_type": "service_launch",
    "date": {
      "start": "1978-06-12",
      "end": "1978-06-12"
    },
    "participants": [
      {
        "actor_ref": "actor.academy",
        "role": "provider"
      }
    ],
    "actions": [
      {
        "actor_refs": [
          "actor.academy"
        ],
        "description": "Academy begins BPI-authorised practical courses and direct distribution under a cooperation agreement. Dealers handle first-line installation enquiries, BPI handles software defects and specialist support, and Logix supports hardware. Tuition, setup services and software licences remain separate."
      }
    ],
    "outcomes": [],
    "agreement_terms": [],
    "metrics": [],
    "product_refs": [
      "service.bpi_training",
      "software.bpi_suite"
    ],
    "related_event_refs": [
      "event.bpi_launch"
    ]
  }
}
