{
  "$schema": "../../../schemas/records/event.schema.json",
  "schema_version": "1.0.0",
  "id": "event.stepper_order",
  "record_type": "event",
  "data": {
    "id": "event.stepper_order",
    "title": "Stepper programme approved and equipment ordered",
    "event_type": "development",
    "date": {
      "start": "1979-01",
      "end": "1979-01"
    },
    "participants": [
      {
        "actor_ref": "actor.labs",
        "role": "manufacturer"
      }
    ],
    "actions": [
      {
        "actor_refs": [
          "actor.labs"
        ],
        "description": "Selected alternative-history milestone; qualify measured process, retention/speed, tool matching and cost before release. Existing processors retain their current process. See memory_manufacturing.json."
      }
    ],
    "outcomes": [],
    "agreement_terms": [],
    "metrics": [],
    "product_refs": [
      "technology.nmos_275um"
    ],
    "related_event_refs": []
  }
}
