{
  "$schema": "../../../schemas/records/event.schema.json",
  "schema_version": "1.0.0",
  "id": "event.capacity_orders_1982",
  "record_type": "event",
  "data": {
    "id": "event.capacity_orders_1982",
    "title": "Order manufacturing expansion ahead of 1982 demand",
    "event_type": "development",
    "date": {
      "start": "1981-01-04",
      "end": "1981-01-04"
    },
    "participants": [
      {
        "actor_ref": "actor.labs",
        "role": "participant"
      }
    ],
    "actions": [
      {
        "actor_refs": [
          "actor.labs"
        ],
        "description": "Adam anticipates demand. Order the January 1982 fab stage four quarters ahead; stage 15/25/35/25 percent of purchases during 1981. Size assembly against the next two quarters and reserve 5% good-output headroom, with OEE and one-down protection separate."
      }
    ],
    "outcomes": [],
    "agreement_terms": [],
    "metrics": [],
    "product_refs": [],
    "related_event_refs": []
  }
}
