{
  "$schema": "../../../schemas/records/event.schema.json",
  "schema_version": "1.0.0",
  "id": "event.portable_cpm_pressure",
  "record_type": "event",
  "data": {
    "id": "event.portable_cpm_pressure",
    "title": "Portable CP/M offerings compete for business buyers",
    "event_type": "development",
    "date": {
      "start": "1981-04-01",
      "end": "1981-04-01"
    },
    "participants": [
      {
        "actor_ref": "actor.others",
        "role": "participant"
      }
    ],
    "actions": [
      {
        "actor_refs": [
          "actor.others"
        ],
        "description": "Osborne-class bundled portable systems make CP/M software libraries and total package cost important. Their historic market segment remains plausible; exact alternative-world volume and component supply are not asserted."
      }
    ],
    "outcomes": [],
    "agreement_terms": [],
    "metrics": [],
    "product_refs": [],
    "related_event_refs": []
  }
}
