{
  "$schema": "../../../schemas/records/event.schema.json",
  "schema_version": "1.0.0",
  "id": "event.tandy_design_review",
  "record_type": "event",
  "data": {
    "id": "event.tandy_design_review",
    "title": "Model II compatibility design baseline agreed",
    "event_type": "development",
    "date": {
      "start": "1978-12-15",
      "end": "1978-12-15"
    },
    "participants": [
      {
        "actor_ref": "actor.tandy",
        "role": "participant"
      },
      {
        "actor_ref": "actor.logix",
        "role": "participant"
      },
      {
        "actor_ref": "actor.dri",
        "role": "participant"
      },
      {
        "actor_ref": "actor.aion",
        "role": "participant"
      }
    ],
    "actions": [
      {
        "actor_refs": [
          "actor.tandy",
          "actor.logix",
          "actor.dri",
          "actor.aion"
        ],
        "description": "Reserve an internal option-board slot and interface/power budget before the scenario design baseline is closed. Freeze CP/M BIOS responsibilities, native display/keyboard adapter and the FlexiBUS connector plan. This review is an invented alternate-history engineering milestone, not a claim about the real Model II freeze date."
      }
    ],
    "outcomes": [],
    "agreement_terms": [],
    "metrics": [],
    "product_refs": [
      "computer.trs80_model_ii",
      "software.cpm_model_ii",
      "device.model_ii_flexibus",
      "edition.abacus_1.model_ii"
    ],
    "related_event_refs": [
      "event.tandy_agreement"
    ]
  }
}
