{
  "$schema": "../../../schemas/records/event.schema.json",
  "schema_version": "1.0.0",
  "id": "event.clone_campaign_roadshows",
  "record_type": "event",
  "data": {
    "id": "event.clone_campaign_roadshows",
    "title": "International launch roadshows and Academy workshops",
    "event_type": "action",
    "date": {
      "start": "1982-02-01",
      "end": "1982-02-01"
    },
    "participants": [
      {
        "actor_ref": "actor.academy",
        "role": "programme_partner"
      },
      {
        "actor_ref": "actor.logix",
        "role": "programme_partner"
      },
      {
        "actor_ref": "actor.aion_tech_uk",
        "role": "programme_partner"
      },
      {
        "actor_ref": "actor.northstar",
        "role": "programme_partner"
      },
      {
        "actor_ref": "actor.vector",
        "role": "programme_partner"
      },
      {
        "actor_ref": "actor.sks",
        "role": "programme_partner"
      },
      {
        "actor_ref": "actor.goupil",
        "role": "programme_partner"
      },
      {
        "actor_ref": "actor.eina",
        "role": "programme_partner"
      }
    ],
    "actions": [
      {
        "actor_refs": [
          "actor.academy",
          "actor.logix",
          "actor.aion_tech_uk",
          "actor.northstar",
          "actor.vector",
          "actor.sks",
          "actor.goupil",
          "actor.eina"
        ],
        "description": "January–March campaign: local-language business press, hands-on dealer events, Academy sessions, customer-site demonstrations and specialist-developer workshops. Measure prospects, unique purchasing organisations, conversion, support wait times and sell-through separately. Partner sales and Logix sales remain distinct; no automatic campaign sales uplift."
      }
    ],
    "outcomes": [],
    "agreement_terms": [],
    "metrics": [],
    "product_refs": [],
    "related_event_refs": []
  }
}
