{
  "$schema": "../../../schemas/records/event.schema.json",
  "schema_version": "1.0.0",
  "id": "event.sgs_transfer_agreement",
  "record_type": "event",
  "data": {
    "id": "event.sgs_transfer_agreement",
    "title": "SGS-ATES funded second-source agreement",
    "event_type": "agreement",
    "date": {
      "start": "1981-03-16",
      "end": "1981-03-16"
    },
    "participants": [
      {
        "actor_ref": "actor.adam",
        "role": "programme_partner"
      },
      {
        "actor_ref": "actor.labs",
        "role": "programme_partner"
      },
      {
        "actor_ref": "actor.sgs",
        "role": "programme_partner"
      }
    ],
    "actions": [
      {
        "actor_refs": [
          "actor.adam",
          "actor.labs",
          "actor.sgs"
        ],
        "description": "Execute the accepted scenario transfer framework. Funding shares are planning commitments against a yet-to-be-costed programme; royalty and dedicated-equipment terms remain negotiable. Target first controller production in 1981 and ERA ramp across late 1981/1982 after qualification."
      }
    ],
    "outcomes": [],
    "metrics": [],
    "product_refs": [],
    "related_event_refs": []
  }
}
