{
  "$schema": "../../../schemas/records/event.schema.json",
  "schema_version": "1.0.0",
  "id": "event.network_pilots",
  "record_type": "event",
  "data": {
    "id": "event.network_pilots",
    "title": "Dealers and BPI gate server sales on recovery tests",
    "event_type": "development",
    "date": {
      "start": "1981-06-30",
      "end": "1981-06-30"
    },
    "participants": [
      {
        "actor_ref": "actor.bpi",
        "role": "participant"
      }
    ],
    "actions": [
      {
        "actor_refs": [
          "actor.bpi"
        ],
        "description": "Run multi-client authentication, locking, backup and crash-recovery pilots. PRO shipments from July remain conditional. Five-megabyte storage confines early Team Edition deployments to small repositories; larger storage remains unpriced and contributes no forecast revenue."
      }
    ],
    "outcomes": [],
    "agreement_terms": [],
    "metrics": [],
    "product_refs": [],
    "related_event_refs": []
  }
}
