{
  "$schema": "../../../schemas/records/event.schema.json",
  "schema_version": "1.0.0",
  "id": "event.oem79_briefings",
  "record_type": "event",
  "data": {
    "id": "event.oem79_briefings",
    "title": "Independent OEM and peripheral engineering briefings",
    "event_type": "plan",
    "date": {
      "start": "1979-02-19",
      "end": "1979-02-19"
    },
    "participants": [
      {
        "actor_ref": "actor.logix",
        "role": "programme organiser"
      },
      {
        "actor_ref": "actor.aion",
        "role": "programme organiser"
      },
      {
        "actor_ref": "actor.dri",
        "role": "programme organiser"
      }
    ],
    "actions": [
      {
        "actor_refs": [
          "actor.logix",
          "actor.aion",
          "actor.dri"
        ],
        "description": "Begin confidential briefings and engineering-kit evaluations. Prioritise North Star and Vector Graphic as prospects; approach Cromemco, Altos, Intertec and Heath selectively. Invitations are not signed agreements or qualified products. This day is a selected scenario milestone."
      }
    ],
    "outcomes": [],
    "agreement_terms": [],
    "metrics": [],
    "product_refs": [
      "technology.flexibus",
      "technology.logix_tui_standard",
      "software.aurelia_sdk"
    ],
    "related_event_refs": [
      "event.dri_portable"
    ]
  }
}
