{
  "$schema": "../../../schemas/records/event.schema.json",
  "schema_version": "1.0.0",
  "id": "event.clone_release_gate",
  "record_type": "event",
  "data": {
    "id": "event.clone_release_gate",
    "title": "January launch release and supply readiness review",
    "event_type": "development",
    "date": {
      "start": "1981-12-14",
      "end": "1981-12-14"
    },
    "participants": [
      {
        "actor_ref": "actor.logix",
        "role": "programme_partner"
      },
      {
        "actor_ref": "actor.labs",
        "role": "programme_partner"
      },
      {
        "actor_ref": "actor.sgs",
        "role": "programme_partner"
      },
      {
        "actor_ref": "actor.aion",
        "role": "programme_partner"
      },
      {
        "actor_ref": "actor.aion_tech_uk",
        "role": "programme_partner"
      },
      {
        "actor_ref": "actor.northstar",
        "role": "programme_partner"
      },
      {
        "actor_ref": "actor.vector",
        "role": "programme_partner"
      },
      {
        "actor_ref": "actor.sks",
        "role": "programme_partner"
      },
      {
        "actor_ref": "actor.goupil",
        "role": "programme_partner"
      },
      {
        "actor_ref": "actor.eina",
        "role": "programme_partner"
      }
    ],
    "actions": [
      {
        "actor_refs": [
          "actor.logix",
          "actor.labs",
          "actor.sgs",
          "actor.aion",
          "actor.aion_tech_uk",
          "actor.northstar",
          "actor.vector",
          "actor.sks",
          "actor.goupil",
          "actor.eina"
        ],
        "description": "Approve initial country configurations and local platform editions, complete warranty/support ownership, stock allocation, dealer/instructor readiness and country price sheets. Reserve production at demand plus 5% headroom once country demand is assessed; do not add 5% to sales. AION is the fallback for SGS-unqualified parts. Delay only failing configurations, keeping Logix/third-party complements available."
      }
    ],
    "outcomes": [],
    "agreement_terms": [],
    "metrics": [],
    "product_refs": [],
    "related_event_refs": []
  }
}
